[INFO] Scanning for projects...
[INFO] 
[INFO] ------------------------< com.neosystem:sifen >-------------------------
[INFO] Building sifen 0.0.1-SNAPSHOT
[INFO]   from pom.xml
[INFO] --------------------------------[ jar ]---------------------------------
[INFO] 
[INFO] --- resources:3.3.1:resources (default-resources) @ sifen ---
[INFO] Copying 1 resource from src\main\resources to target\classes
[INFO] Copying 0 resource from src\main\resources to target\classes
[INFO] 
[INFO] --- compiler:3.13.0:compile (default-compile) @ sifen ---
[INFO] Nothing to compile - all classes are up to date.
[INFO] 
[INFO] --- resources:3.3.1:testResources (default-testResources) @ sifen ---
[INFO] skip non existing resourceDirectory C:\Users\angel\Documentos\NeoSystem\Proyectos\sifen\src\test\resources
[INFO] 
[INFO] --- compiler:3.13.0:testCompile (default-testCompile) @ sifen ---
[INFO] Nothing to compile - all classes are up to date.
[INFO] 
[INFO] --- surefire:3.5.2:test (default-test) @ sifen ---
[INFO] Using auto detected provider org.apache.maven.surefire.junitplatform.JUnitPlatformProvider
[INFO] 
[INFO] -------------------------------------------------------
[INFO]  T E S T S
[INFO] -------------------------------------------------------
[INFO] Running com.neosystem.sifen.infrastructure.adapters.sifen.SifenSoapClientAdapterTest
21:17:53.067 [main] INFO org.springframework.test.context.support.AnnotationConfigContextLoaderUtils -- Could not detect default configuration classes for test class [com.neosystem.sifen.infrastructure.adapters.sifen.SifenSoapClientAdapterTest]: SifenSoapClientAdapterTest does not declare any static, non-private, non-final, nested classes annotated with @Configuration.
21:17:53.179 [main] INFO org.springframework.boot.test.context.SpringBootTestContextBootstrapper -- Found @SpringBootConfiguration com.neosystem.sifen.SifenApplication for test class com.neosystem.sifen.infrastructure.adapters.sifen.SifenSoapClientAdapterTest

  .   ____          _            __ _ _
 /\\ / ___'_ __ _ _(_)_ __  __ _ \ \ \ \
( ( )\___ | '_ | '_| | '_ \/ _` | \ \ \ \
 \\/  ___)| |_)| | | | | || (_| |  ) ) ) )
  '  |____| .__|_| |_|_| |_\__, | / / / /
 =========|_|==============|___/=/_/_/_/

 :: Spring Boot ::                (v3.4.2)

2026-02-03T21:17:53.651-03:00  INFO 10112 --- [           main] c.n.s.i.a.s.SifenSoapClientAdapterTest   : Starting SifenSoapClientAdapterTest using Java 21.0.10 with PID 10112 (started by angel in C:\Users\angel\Documentos\NeoSystem\Proyectos\sifen)
2026-02-03T21:17:53.653-03:00  INFO 10112 --- [           main] c.n.s.i.a.s.SifenSoapClientAdapterTest   : No active profile set, falling back to 1 default profile: "default"
2026-02-03T21:17:54.582-03:00  WARN 10112 --- [           main] trationDelegate$BeanPostProcessorChecker : Bean 'org.springframework.ws.config.annotation.DelegatingWsConfiguration' of type [org.springframework.ws.config.annotation.DelegatingWsConfiguration$$SpringCGLIB$$0] is not eligible for getting processed by all BeanPostProcessors (for example: not eligible for auto-proxying). The currently created BeanPostProcessor [annotationActionEndpointMapping] is declared through a non-static factory method on that class; consider declaring it as static instead.
2026-02-03T21:17:54.612-03:00  INFO 10112 --- [           main] .w.s.a.s.AnnotationActionEndpointMapping : Supporting [WS-Addressing August 2004, WS-Addressing 1.0]
2026-02-03T21:17:54.632-03:00  INFO 10112 --- [           main] o.s.ws.soap.saaj.SaajSoapMessageFactory  : Creating SAAJ 1.3 MessageFactory with SOAP 1.2 Protocol
2026-02-03T21:17:54.639-03:00 DEBUG 10112 --- [           main] o.s.ws.soap.saaj.SaajSoapMessageFactory  : Using MessageFactory class [com.sun.xml.messaging.saaj.soap.ver1_2.SOAPMessageFactory1_2Impl]
2026-02-03T21:17:55.389-03:00 DEBUG 10112 --- [           main] yloadRootAnnotationMethodEndpointMapping : Looking for endpoints in application context: org.springframework.web.context.support.GenericWebApplicationContext@5d28bcd5, started on Tue Feb 03 21:17:53 PYT 2026
2026-02-03T21:17:55.393-03:00 DEBUG 10112 --- [           main] oapActionAnnotationMethodEndpointMapping : Looking for endpoints in application context: org.springframework.web.context.support.GenericWebApplicationContext@5d28bcd5, started on Tue Feb 03 21:17:53 PYT 2026
2026-02-03T21:17:55.419-03:00 DEBUG 10112 --- [           main] o.s.w.s.e.a.DefaultMethodEndpointAdapter : No MethodArgumentResolvers set, using defaults: [org.springframework.ws.server.endpoint.adapter.method.dom.DomPayloadMethodProcessor@2f9dda71, org.springframework.ws.server.endpoint.adapter.method.MessageContextMethodArgumentResolver@58278366, org.springframework.ws.server.endpoint.adapter.method.SourcePayloadMethodProcessor@7f5fcfe9, org.springframework.ws.server.endpoint.adapter.method.XPathParamMethodArgumentResolver@707865bd, org.springframework.ws.soap.server.endpoint.adapter.method.SoapMethodArgumentResolver@31f77791, org.springframework.ws.soap.server.endpoint.adapter.method.SoapHeaderElementMethodArgumentResolver@552fee7a, org.springframework.ws.server.endpoint.adapter.method.jaxb.XmlRootElementPayloadMethodProcessor@548e43b1, org.springframework.ws.server.endpoint.adapter.method.jaxb.JaxbElementPayloadMethodProcessor@67688110, org.springframework.ws.server.endpoint.adapter.method.StaxPayloadMethodArgumentResolver@6d293993]
2026-02-03T21:17:55.420-03:00 DEBUG 10112 --- [           main] o.s.w.s.e.a.DefaultMethodEndpointAdapter : No MethodReturnValueHandlers set, using defaults: [org.springframework.ws.server.endpoint.adapter.method.dom.DomPayloadMethodProcessor@6a55594b, org.springframework.ws.server.endpoint.adapter.method.SourcePayloadMethodProcessor@632b305d, org.springframework.ws.server.endpoint.adapter.method.jaxb.XmlRootElementPayloadMethodProcessor@44598ef7, org.springframework.ws.server.endpoint.adapter.method.jaxb.JaxbElementPayloadMethodProcessor@57fdb8a4]
2026-02-03T21:17:55.453-03:00  INFO 10112 --- [           main] c.n.s.i.a.s.SifenSoapClientAdapterTest   : Started SifenSoapClientAdapterTest in 2.115 seconds (process running for 3.023)
Mockito is currently self-attaching to enable the inline-mock-maker. This will no longer work in future releases of the JDK. Please add Mockito as an agent to your build what is described in Mockito's documentation: https://javadoc.io/doc/org.mockito/mockito-core/latest/org/mockito/Mockito.html#0.3
Java HotSpot(TM) 64-Bit Server VM warning: Sharing is only supported for boot loader classes because bootstrap classpath has been appended
WARNING: A Java agent has been loaded dynamically (C:\Users\angel\.m2\repository\net\bytebuddy\byte-buddy-agent\1.15.11\byte-buddy-agent-1.15.11.jar)
WARNING: If a serviceability tool is in use, please run with -XX:+EnableDynamicAgentLoading to hide this warning
WARNING: If a serviceability tool is not in use, please run with -Djdk.instrument.traceUsage for more information
WARNING: Dynamic loading of agents will be disallowed by default in a future release
SIFEN RUC Query Response:
<?xml version="1.0" encoding="UTF-8"?>
<env:Envelope xmlns:env="http://www.w3.org/2003/05/soap-envelope"><env:Header/><env:Body><ns2:rRetEnviDe xmlns:ns2="http://ekuatia.set.gov.py/sifen/xsd"><ns2:rProtDe><ns2:dFecProc>2026-02-03T21:17:59-03:00</ns2:dFecProc><ns2:dEstRes>Rechazado</ns2:dEstRes><ns2:gResProc><ns2:dCodRes>0160</ns2:dCodRes><ns2:dMsgRes>XML Mal Formado.</ns2:dMsgRes></ns2:gResProc></ns2:rProtDe></ns2:rRetEnviDe></env:Body></env:Envelope>
Consulta DE Response: <?xml version="1.0" encoding="UTF-8"?>
<env:Envelope xmlns:env="http://www.w3.org/2003/05/soap-envelope"><env:Header/><env:Body><ns2:rEnviConsDeResponse xmlns:ns2="http://ekuatia.set.gov.py/sifen/xsd"><ns2:dFecProc>2026-02-03T21:17:59-03:00</ns2:dFecProc><ns2:dCodRes>0420</ns2:dCodRes><ns2:dMsgRes>Documento No Existe en SIFEN o ha sido Rechazado</ns2:dMsgRes></ns2:rEnviConsDeResponse></env:Body></env:Envelope>
Signed XML: <?xml version="1.0" encoding="UTF-8" standalone="no"?><ns3:rDE xmlns:ns3="http://ekuatia.set.gov.py/sifen/xsd" xmlns:ns2="http://www.w3.org/2000/09/xmldsig#"><dVerFor>150</dVerFor><DE Id="01800015681001001000000122026020311234567891"><dId>01800015681001001000000122026020311234567891</dId><dDvId>1</dDvId><dFecFirma>2026-02-03T10:00:00</dFecFirma><dSisFact>1</dSisFact><gOpeDE><iTipEmi>1</iTipEmi><dDesTipEmi>Normal</dDesTipEmi><dCodSeg>123456</dCodSeg></gOpeDE><gTimb><iTiDE>1</iTiDE><dDesTiDE>Factura</dDesTiDE><dNumTim>12345678</dNumTim><dEst>001</dEst><dPunExp>001</dPunExp><dNumDoc>0000001</dNumDoc><dFeIniT>2026-01-01</dFeIniT></gTimb><gDatGralOpe><dFeEmiDE>2026-02-03T10:00:00</dFeEmiDE><gEmis><dRucEm>80001568</dRucEm><dDVEmi>1</dDVEmi><iTipCont>2</iTipCont><dNomEmi>Test S.A.</dNomEmi><dDirEmi>Calle 1</dDirEmi><dNumCas>1</dNumCas><cDepEmi>1</cDepEmi><dDesDepEmi>Capital</dDesDepEmi><cCiuEmi>1</cCiuEmi><dDesCiuEmi>Asu</dDesCiuEmi><dTelEmi>123</dTelEmi><dEmailE>a@a.com</dEmailE></gEmis><gDatRec><iNatRec>1</iNatRec><iTiOpe>1</iTiOpe><cPaisRec>PRY</cPaisRec><dDesPaisRe>Paraguay</dDesPaisRe><dNomRec>Cliente</dNomRec><dDirRec>Calle 2</dDirRec><dNumCasRec>1</dNumCasRec><cDepRec>1</cDepRec><dDesDepRec>Capital</dDesDepRec><cCiuRec>1</cCiuRec><dDesCiuRec>Asu</dDesCiuRec></gDatRec></gDatGralOpe><gDtipDE><gCamFE><iIndPres>1</iIndPres><dDesIndPres>Pres</dDesIndPres></gCamFE></gDtipDE><gTotSub><dTotOpe>100</dTotOpe><dTotGralOpe>100</dTotGralOpe><dTotIVA>0</dTotIVA></gTotSub><gCamItem><dCodInt>1</dCodInt><dDesProSer>Prod</dDesProSer><cUniMed>77</cUniMed><dDesUniMed>Uni</dDesUniMed><dCantProSer>1</dCantProSer><gValorItem><dPUnitPro>100</dPUnitPro><dTotBruOpeItem>100</dTotBruOpeItem><gValorRestaItem><dTotOpeItem>100</dTotOpeItem></gValorRestaItem></gValorItem><gCamIVA><iAfecIVA>3</iAfecIVA><dDesAfecIVA>Exento</dDesAfecIVA><dPropIVA>0</dPropIVA><dTasaIVA>0</dTasaIVA><dLiqIVAItem>0</dLiqIVAItem></gCamIVA></gCamItem></DE><Signature xmlns="http://www.w3.org/2000/09/xmldsig#">
<SignedInfo>
<CanonicalizationMethod Algorithm="http://www.w3.org/TR/2001/REC-xml-c14n-20010315"/>
<SignatureMethod Algorithm="http://www.w3.org/2001/04/xmldsig-more#rsa-sha256"/>
<Reference URI="">
<Transforms>
<Transform Algorithm="http://www.w3.org/2000/09/xmldsig#enveloped-signature"/>
<Transform Algorithm="http://www.w3.org/2001/10/xml-exc-c14n#"/>
</Transforms>
<DigestMethod Algorithm="http://www.w3.org/2001/04/xmlenc#sha256"/>
<DigestValue>CgPZ50SOCq++S2Eyc5pnTFIova0XeL4mQhYUMOpPXps=</DigestValue>
</Reference>
</SignedInfo>
<SignatureValue>
NpLrPunHiot9j2ISoZHOxHo5fFRZ4FW89quppmnZ/iU18N5v7IkKP5+Td6yuegxnQI7p3iu6T2A+&#13;
X1VpnMFb0B+L9bX5iJvxrdq3S9OwHDN0lqm6nWC04XwlsKDq61r8MAl5p7sT4S3CyViggKlP6f1n&#13;
KKRnI6MMtkgMlZIeId35GVRQ3ygADslh1pnp4m+781srxq9npsu70Oj0Z4QYycYKCGTClYo/oH7L&#13;
9U0v2egvJrXm67mU3CVWqVAW2I+Wj5ya7hq/c8X5hlxC670GZJZtKSkHP8wGmZSj09eVM3SZuFnL&#13;
3tdwHTNae4+hhpNbCD9V3KcACL4e9s9dstl3OA==
</SignatureValue>
<KeyInfo>
<X509Data>
<X509Certificate>
MIIJAzCCBuugAwIBAgIIEc5yYCzv5LgwDQYJKoZIhvcNAQELBQAwWjEaMBgGA1UEAwwRQ0EtRE9D&#13;
VU1FTlRBIFMuQS4xFjAUBgNVBAUTDVJVQzgwMDUwMTcyLTExFzAVBgNVBAoMDkRPQ1VNRU5UQSBT&#13;
LkEuMQswCQYDVQQGEwJQWTAeFw0yNjAxMjMxODIwMDBaFw0yNzAxMjMxODIwMDBaMIGvMSMwIQYD&#13;
VQQDDBpBTkdFTCBEQVZJRCBNQUxET05BRE8gU09TQTESMBAGA1UEBRMJQ0k0OTQ1MjU0MRQwEgYD&#13;
VQQqDAtBTkdFTCBEQVZJRDEXMBUGA1UEBAwOTUFMRE9OQURPIFNPU0ExCzAJBgNVBAsMAkYxMSsw&#13;
KQYDVQQKDCJDRVJUSUZJQ0FETyBDVUFMSUZJQ0FETyBUUklCVVRBUklPMQswCQYDVQQGEwJQWTCC&#13;
ASIwDQYJKoZIhvcNAQEBBQADggEPADCCAQoCggEBAILs8QvkSrW1DaKgfjDdHRvvdYIgwYT6Ix1J&#13;
IayhxaCDCWgS+/JzEjavhqrLY3JoNDBH9hgacxD2bb7r3S0BEWOkCBkCufbn7XCnddBvM6A81njm&#13;
Q9FP67+fXTO5R6vtO76COFmLx1sfRke2tI2oAcM4mlcq6T9lzkCNyC22e1Qm2m0HS2E4rOAq0Ti0&#13;
qzMZkGDjWp8XUOzXWUe+mJiyNCLINGweZhJW3ucPkAAdp2yQRq/0RmXLSHXkN4J1mHtuxNW1Epdy&#13;
y99yMwfTzg+4iG+pu0HeYXe4ec9xJCfVdowOcwBIcFEQHoaOuyFhNNUMsK0ESG6lEkDp6U5X22Pu&#13;
XNsCAwEAAaOCBHUwggRxMAwGA1UdEwEB/wQCMAAwHwYDVR0jBBgwFoAUoT2FK83YLJYfOQIMn1M7&#13;
WNiVC3swgZQGCCsGAQUFBwEBBIGHMIGEMFUGCCsGAQUFBzAChklodHRwczovL3d3dy5kaWdpdG8u&#13;
Y29tLnB5L3VwbG9hZHMvY2VydGlmaWNhZG8tZG9jdW1lbnRhLXNhLTE1MzUxMTc3NzEuY3J0MCsG&#13;
CCsGAQUFBzABhh9odHRwczovL3d3dy5kaWdpdG8uY29tLnB5L29jc3AvMIHnBgNVHREEgd8wgdyB&#13;
G2FtYWxkb25hZG9AbmVvc3lzdGVtLmNvbS5weaSBvDCBuTEpMCcGA1UEDQwgRklSTUEgRUxFQ1RS&#13;
T05JQ0EgZGUgbml2ZWwgbWVkaW8xHjAcBgNVBAwMFUdFUkVOVEUgREUgVEVDTk9MT0dJQTEWMBQG&#13;
A1UEBRMNUlVDODAwOTQxNjUtOTElMCMGA1UECwwcVEVDTk9MT0dJQSBERSBMQSBJTkZPUk1BQ0lP&#13;
TjEtMCsGA1UECgwkTkVPIFNZU1RFTSBQQVJBR1VBWSBTT0NJRURBRCBBTk9OSU1BMIIB5QYDVR0g&#13;
BIIB3DCCAdgwggHUBg0rBgEEAYL5OwEBAQwBMIIBwTAvBggrBgEFBQcCARYjaHR0cHM6Ly93d3cu&#13;
ZGlnaXRvLmNvbS5weS9kZXNjYXJnYXMwggGMBggrBgEFBQcCAjCCAX4eggF6AEMAZQByAHQAaQBm&#13;
AGkAYwBhAGQAbwAgAGMAdQBhAGwAaQBmAGkAYwBhAGQAbwAgAGQAZQAgAGYAaQByAG0AYQAgAGUA&#13;
bABlAGMAdAByAPMAbgBpAGMAYQAgAHQAaQBwAG8AIABGADEAIAAoAGMAbABhAHYAZQBzACAAZQBu&#13;
ACAAbQDzAGQAdQBsAG8AIABzAG8AZgB0AHcAYQByAGUAKQAsACAAcwB1AGoAZQB0AGEAIABhACAA&#13;
bABhAHMAIABjAG8AbgBkAGkAYwBpAG8AbgBlAHMAIABkAGUAIAB1AHMAbwAgAGUAeABwAHUAZQBz&#13;
AHQAYQBzACAAZQBuACAAbABhACAARABlAGMAbABhAHIAYQBjAGkA8wBuACAAZABlACAAUAByAOEA&#13;
YwB0AGkAYwBhAHMAIABkAGUAIABDAGUAcgB0AGkAZgBpAGMAYQBjAGkA8wBuACAAZABlACAARABP&#13;
AEMAVQBNAEUATgBUAEEAIABTAC4AQQAuMCoGA1UdJQEB/wQgMB4GCCsGAQUFBwMCBggrBgEFBQcD&#13;
BAYIKwYBBQUHAwEwewYDVR0fBHQwcjA0oDKgMIYuaHR0cHM6Ly93d3cuZGlnaXRvLmNvbS5weS9j&#13;
cmwvZG9jdW1lbnRhX2NhLmNybDA6oDigNoY0aHR0cHM6Ly93d3cuZG9jdW1lbnRhLmNvbS5weS9k&#13;
aWdpdG8vZG9jdW1lbnRhX2NhLmNybDAdBgNVHQ4EFgQUQcwR8FwkDqQiuJGYNz3loJdLF2gwDgYD&#13;
VR0PAQH/BAQDAgXgMA0GCSqGSIb3DQEBCwUAA4ICAQB+tF5qEU9WKV+7KrUvy5nFPuSf5Lrw2qM6&#13;
52i5oXQmDVbS+hV2NPTE16NYOrJNu1XIc9tNYDfafPzKbCBk2IdVfrLdQA5cOEZSU0kXVALFGOlp&#13;
FoX9eLn9Vy1FTQ/RjAL7Bb4QCIffYPNzvC63kzRlUQ1DC7bI47uyAH0UvjMRn/8aOTgHdgyBYhVo&#13;
ueN8B2tEhkhUAqH8n99XAi6pJCSz7ZVLp8nmi42alb3tBxpC/DJlBIhoRLkrqhXJeAp9ymot5bm/&#13;
Xe3swTBiKZM3NyxQgRQCVqhUlYTSv9iF04X6XdLkWIdnpeuHsmYbNzlp2+JJzcSOb/B/JBGNn8Lz&#13;
SctmYrlvdqczhCHZGhViJ/VtcktOLjV+3yHzh9sSKmbmUYJ3n0WTWQzFlu8qMr+qKGYO/Us3k685&#13;
Hnpjh6igpHCBhDxoGYkHZqKzD47vet2ltqEutlYn33L1Nczg29XgNkzziwKv6WFhQucHSn+293h+&#13;
X4vUDkj4JUJ599flRPbXdT8gL+Prvy2mUDmr2Q1U4unJaTkfTGLsLinvoeMEnTj1ypvV3xeLsbGY&#13;
zkGZ0BhMrOHDBs6Jy76n21Dk5s6KlRrpRpzKGzaKbTauSW1Kw1znGj0v5/TiG1QNRk6i9TfKTN3n&#13;
U9ihixwdGwrlR6xKBLYZwWTO3mTAjr3HdrTbQejrcQ==
</X509Certificate>
</X509Data>
<KeyValue>
<RSAKeyValue>
<Modulus>guzxC+RKtbUNoqB+MN0dG+91giDBhPojHUkhrKHFoIMJaBL78nMSNq+Gqstjcmg0MEf2GBpzEPZt&#13;
vuvdLQERY6QIGQK59uftcKd10G8zoDzWeOZD0U/rv59dM7lHq+07voI4WYvHWx9GR7a0jagBwzia&#13;
VyrpP2XOQI3ILbZ7VCbabQdLYTis4CrROLSrMxmQYONanxdQ7NdZR76YmLI0Isg0bB5mElbe5w+Q&#13;
AB2nbJBGr/RGZctIdeQ3gnWYe27E1bUSl3LL33IzB9POD7iIb6m7Qd5hd7h5z3EkJ9V2jA5zAEhw&#13;
URAeho67IWE01QywrQRIbqUSQOnpTlfbY+5c2w==</Modulus>
<Exponent>AQAB</Exponent>
</RSAKeyValue>
</KeyValue>
</KeyInfo>
</Signature></ns3:rDE>
[ERROR] Tests run: 4, Failures: 0, Errors: 2, Skipped: 0, Time elapsed: 7.091 s <<< FAILURE! -- in com.neosystem.sifen.infrastructure.adapters.sifen.SifenSoapClientAdapterTest
[ERROR] com.neosystem.sifen.infrastructure.adapters.sifen.SifenSoapClientAdapterTest.testRecibeEvento -- Time elapsed: 0.056 s <<< ERROR!
java.lang.RuntimeException: Error communicating with SIFEN: Connection reset
	at com.neosystem.sifen.infrastructure.adapters.sifen.SifenSoapClientAdapter.sendRawSoapRequest(SifenSoapClientAdapter.java:116)
	at com.neosystem.sifen.infrastructure.adapters.sifen.SifenSoapClientAdapter.recibeEvento(SifenSoapClientAdapter.java:71)
	at com.neosystem.sifen.infrastructure.adapters.sifen.SifenSoapClientAdapterTest.testRecibeEvento(SifenSoapClientAdapterTest.java:189)
	at java.base/java.lang.reflect.Method.invoke(Method.java:580)
	at java.base/java.util.ArrayList.forEach(ArrayList.java:1596)
	at java.base/java.util.ArrayList.forEach(ArrayList.java:1596)
Caused by: java.net.SocketException: Connection reset
	at java.base/sun.nio.ch.NioSocketImpl.implRead(NioSocketImpl.java:318)
	at java.base/sun.nio.ch.NioSocketImpl.read(NioSocketImpl.java:346)
	at java.base/sun.nio.ch.NioSocketImpl$1.read(NioSocketImpl.java:796)
	at java.base/java.net.Socket$SocketInputStream.read(Socket.java:1099)
	at java.base/sun.security.ssl.SSLSocketInputRecord.read(SSLSocketInputRecord.java:489)
	at java.base/sun.security.ssl.SSLSocketInputRecord.readHeader(SSLSocketInputRecord.java:483)
	at java.base/sun.security.ssl.SSLSocketInputRecord.bytesInCompletePacket(SSLSocketInputRecord.java:70)
	at java.base/sun.security.ssl.SSLSocketImpl.readApplicationRecord(SSLSocketImpl.java:1461)
	at java.base/sun.security.ssl.SSLSocketImpl$AppInputStream.read(SSLSocketImpl.java:1066)
	at java.base/java.io.BufferedInputStream.fill(BufferedInputStream.java:291)
	at java.base/java.io.BufferedInputStream.read1(BufferedInputStream.java:347)
	at java.base/java.io.BufferedInputStream.implRead(BufferedInputStream.java:420)
	at java.base/java.io.BufferedInputStream.read(BufferedInputStream.java:399)
	at java.base/sun.net.www.http.HttpClient.parseHTTPHeader(HttpClient.java:827)
	at java.base/sun.net.www.http.HttpClient.parseHTTP(HttpClient.java:759)
	at java.base/sun.net.www.http.HttpClient.parseHTTP(HttpClient.java:786)
	at java.base/sun.net.www.protocol.http.HttpURLConnection.getInputStream0(HttpURLConnection.java:1706)
	at java.base/sun.net.www.protocol.http.HttpURLConnection.getInputStream(HttpURLConnection.java:1615)
	at java.base/java.net.HttpURLConnection.getResponseCode(HttpURLConnection.java:531)
	at java.base/sun.net.www.protocol.https.HttpsURLConnectionImpl.getResponseCode(HttpsURLConnectionImpl.java:307)
	at com.neosystem.sifen.infrastructure.adapters.sifen.SifenSoapClientAdapter.sendRawSoapRequest(SifenSoapClientAdapter.java:103)
	... 5 more

[ERROR] com.neosystem.sifen.infrastructure.adapters.sifen.SifenSoapClientAdapterTest.testRecibe -- Time elapsed: 0.310 s <<< ERROR!
java.lang.RuntimeException: Error communicating with SIFEN: Connection reset
	at com.neosystem.sifen.infrastructure.adapters.sifen.SifenSoapClientAdapter.sendRawSoapRequest(SifenSoapClientAdapter.java:116)
	at com.neosystem.sifen.infrastructure.adapters.sifen.SifenSoapClientAdapter.recibe(SifenSoapClientAdapter.java:32)
	at com.neosystem.sifen.infrastructure.adapters.sifen.SifenSoapClientAdapterTest.testRecibe(SifenSoapClientAdapterTest.java:141)
	at java.base/java.lang.reflect.Method.invoke(Method.java:580)
	at java.base/java.util.ArrayList.forEach(ArrayList.java:1596)
	at java.base/java.util.ArrayList.forEach(ArrayList.java:1596)
Caused by: java.net.SocketException: Connection reset
	at java.base/sun.nio.ch.NioSocketImpl.implRead(NioSocketImpl.java:318)
	at java.base/sun.nio.ch.NioSocketImpl.read(NioSocketImpl.java:346)
	at java.base/sun.nio.ch.NioSocketImpl$1.read(NioSocketImpl.java:796)
	at java.base/java.net.Socket$SocketInputStream.read(Socket.java:1099)
	at java.base/sun.security.ssl.SSLSocketInputRecord.read(SSLSocketInputRecord.java:489)
	at java.base/sun.security.ssl.SSLSocketInputRecord.readHeader(SSLSocketInputRecord.java:483)
	at java.base/sun.security.ssl.SSLSocketInputRecord.bytesInCompletePacket(SSLSocketInputRecord.java:70)
	at java.base/sun.security.ssl.SSLSocketImpl.readApplicationRecord(SSLSocketImpl.java:1461)
	at java.base/sun.security.ssl.SSLSocketImpl$AppInputStream.read(SSLSocketImpl.java:1066)
	at java.base/java.io.BufferedInputStream.fill(BufferedInputStream.java:291)
	at java.base/java.io.BufferedInputStream.read1(BufferedInputStream.java:347)
	at java.base/java.io.BufferedInputStream.implRead(BufferedInputStream.java:420)
	at java.base/java.io.BufferedInputStream.read(BufferedInputStream.java:399)
	at java.base/sun.net.www.http.HttpClient.parseHTTPHeader(HttpClient.java:827)
	at java.base/sun.net.www.http.HttpClient.parseHTTP(HttpClient.java:759)
	at java.base/sun.net.www.http.HttpClient.parseHTTP(HttpClient.java:786)
	at java.base/sun.net.www.protocol.http.HttpURLConnection.getInputStream0(HttpURLConnection.java:1706)
	at java.base/sun.net.www.protocol.http.HttpURLConnection.getInputStream(HttpURLConnection.java:1615)
	at java.base/java.net.HttpURLConnection.getResponseCode(HttpURLConnection.java:531)
	at java.base/sun.net.www.protocol.https.HttpsURLConnectionImpl.getResponseCode(HttpsURLConnectionImpl.java:307)
	at com.neosystem.sifen.infrastructure.adapters.sifen.SifenSoapClientAdapter.sendRawSoapRequest(SifenSoapClientAdapter.java:103)
	... 5 more

[INFO] 
[INFO] Results:
[INFO] 
[ERROR] Errors: 
[ERROR]   SifenSoapClientAdapterTest.testRecibe:141 ╗ Runtime Error communicating with SIFEN: Connection reset
[ERROR]   SifenSoapClientAdapterTest.testRecibeEvento:189 ╗ Runtime Error communicating with SIFEN: Connection reset
[INFO] 
[ERROR] Tests run: 4, Failures: 0, Errors: 2, Skipped: 0
[INFO] 
[INFO] ------------------------------------------------------------------------
[INFO] BUILD FAILURE
[INFO] ------------------------------------------------------------------------
[INFO] Total time:  9.515 s
[INFO] Finished at: 2026-02-03T21:18:00-03:00
[INFO] ------------------------------------------------------------------------
[ERROR] Failed to execute goal org.apache.maven.plugins:maven-surefire-plugin:3.5.2:test (default-test) on project sifen: 
[ERROR] 
[ERROR] See C:\Users\angel\Documentos\NeoSystem\Proyectos\sifen\target\surefire-reports for the individual test results.
[ERROR] See dump files (if any exist) [date].dump, [date]-jvmRun[N].dump and [date].dumpstream.
[ERROR] -> [Help 1]
[ERROR] 
[ERROR] To see the full stack trace of the errors, re-run Maven with the -e switch.
[ERROR] Re-run Maven using the -X switch to enable full debug logging.
[ERROR] 
[ERROR] For more information about the errors and possible solutions, please read the following articles:
[ERROR] [Help 1] http://cwiki.apache.org/confluence/display/MAVEN/MojoFailureException
